candidate_id,paper_or_dataset,source_url,local_path,sha256,contrast_or_sheet,status,exclusion_category,pipeline,species,cell_system,hypoxia_modality,n_ctrl,n_treat,n_genes_reported,gene_column,lfc_column,p_column,padj_column,notes
HYP012,GSE70544 Cuffdiff Gencode,https://ftp.ncbi.nlm.nih.gov/geo/series/GSE70nnn/GSE70544/suppl/GSE70544_Normoxia_vs_Hypoxia_Gencode_gene_exp.diff.txt.gz,data/deg/raw/iter7/GSE70544_Normoxia_vs_Hypoxia_Gencode_gene_exp.diff.txt.gz,124b3f5fc2991096df382f68fb0ec539bbfea2cbe5ce3c080287023a240af346,Normoxia_vs_Hypoxia_Gencode_gene_exp.diff,active,none,Cuffdiff,Homo sapiens,HPTEC_HCK8 proximal tubular epithelial cells,0.1% O2 12 h,3,3,32201,gene_id,log2(fold_change),p_value,q_value,"Full Cuffdiff table from GEO; metadata in the Biomedicines source-study table has three control and three hypoxia-treated HPTEC_HCK8 samples."
HYP013,GSE108676 mapped Cuffdiff,https://ftp.ncbi.nlm.nih.gov/geo/series/GSE108nnn/GSE108676/suppl/GSE108676_Human_gene_exp.diff.gz,data/deg/raw/iter7/GSE108676_human_refseq_mapped_hypoxia_vs_normoxia.csv,6e523a2b368ab19132b75bb65cf6ded89b149a1353a83b9f5117998f16185107,Human_gene_exp.diff mapped RefSeq to symbols,active,none,Cuffdiff_NCBI_ESummary_mapped,Homo sapiens,iPS-derived cardiomyocytes,1% O2 24 h,3,3,27721,gene_symbol,hypoxia_log2FoldChange,pvalue,padj,"Full Cuffdiff table from GEO; source RefSeq transcript IDs were mapped to gene symbols with NCBI ESummary nuccore title metadata. Mapping table sha256: 471a75fe1094244c245456c9988c9c4f6bf3fe8ff9cfd4ed985b506b55d3b935."
ITER7-C01,GSE70544 Cuffdiff Rinn,https://ftp.ncbi.nlm.nih.gov/geo/series/GSE70nnn/GSE70544/suppl/GSE70544_Normoxia_vs_Hypoxia_Rinn_gene_exp.diff.txt.gz,data/deg/raw/iter7/GSE70544_Normoxia_vs_Hypoxia_Rinn_gene_exp.diff.txt.gz,94cedfe981a0709d8b2a90db2d56bfc992e2c6a91a44a0113c9cae654f5ff4ba,Normoxia_vs_Hypoxia_Rinn_gene_exp.diff,deferred,duplicate_annotation_set,Cuffdiff,Homo sapiens,HPTEC_HCK8 proximal tubular epithelial cells,0.1% O2 12 h,3,3,29352,gene_id,log2(fold_change),p_value,q_value,"Same biological contrast as HYP012 but alternate annotation set; deferred to avoid double-counting the same source."
ITER7-C02,GSE60217 HYP_NORM expression,https://ftp.ncbi.nlm.nih.gov/geo/series/GSE60nnn/GSE60217/suppl/GSE60217_Expression_HYP_NORM.csv.gz,data/deg/raw/iter7/GSE60217_Expression_HYP_NORM.csv.gz,ecb89bfff6ce6b83c609d6102c55e2e328e6ada1113937a761ba0255e556bad0,HUVEC hypoxia/normoxia expression matrix,excluded,expression_only,expression_matrix,Homo sapiens,HUVEC,1% O2 24 h,2,2,62016,gene_short_name,,,,"Processed expression matrix has hypoxia and normoxia columns but no contrast-level p-values or adjusted p-values."
ITER7-C03,GSE60217 gene expression,https://ftp.ncbi.nlm.nih.gov/geo/series/GSE60nnn/GSE60217/suppl/GSE60217_Gene_Expression.tsv.gz,data/deg/raw/iter7/GSE60217_Gene_Expression.tsv.gz,042aa377d681f3e8a14a583341c47fdf2273e329cf48891d38f61bf42051d7c8,siADAR gene expression matrix,excluded,expression_only,expression_matrix,Homo sapiens,HUVEC,knockdown expression,,,62016,gene_short_name,,,,"Expression matrix for knockdown-related samples, not an as-deposited hypoxia-vs-normoxia DEG table."
ITER7-C04,GSE232797 RNA-seq data,https://ftp.ncbi.nlm.nih.gov/geo/series/GSE232nnn/GSE232797/suppl/GSE232797_data_RNAseq.csv.gz,data/deg/raw/iter7/GSE232797_data_RNAseq.csv.gz,c4f4740a26be4fc1f6881ac57324adb4d9f80412ca85faee9a7610d8da7ff9a2,Nx/Hx siRNA RNA-seq count matrix,excluded,raw_counts_only,raw_counts,Homo sapiens,not resolved,hypoxia plus siRNA perturbations,3,3,57820,Ensembl ID,,,,"Count matrix includes normoxia and hypoxia siNC samples but no as-deposited DE statistics; reserve for possible V2 reanalysis."
ITER7-C05,GSE328627 WT 5% vs 16% oxygen DEG,https://ftp.ncbi.nlm.nih.gov/geo/series/GSE328nnn/GSE328627/suppl/GSE328627_WT_5vsWT_16_DEG_all.xls.gz,data/deg/raw/iter7/GSE328627_WT_5vsWT_16_DEG_all.xls.gz,4e185278fa8d1c739d3215704971d5b361e064c5524bbc5e3f4bc59e478f30bf,WT_5vsWT_16_DEG_all,excluded,reported_gene_universe_lt_10000,DESeq2,Homo sapiens,not resolved,5% O2 versus 16% O2,,,1680,gene_name,log2FoldChange,pvalue,padj,"Direct oxygen contrast but the reported DEG table is significant/top-hit scale and below the near-full-universe threshold."
ITER7-C06,GSE328627 P8 FG vs WT 16 DEG,https://ftp.ncbi.nlm.nih.gov/geo/series/GSE328nnn/GSE328627/suppl/GSE328627_P8_FGvsWT_16_DEG_all.xls.gz,data/deg/raw/iter7/GSE328627_P8_FGvsWT_16_DEG_all.xls.gz,968b8186f48efdeb6539d4f27ee984ed855f25e7a777edafd223d4b42700aa69,P8_FGvsWT_16_DEG_all,excluded,not_hypoxia_vs_normoxia,DESeq2,Homo sapiens,not resolved,HIF-PHI/drug perturbation versus 16% O2,,,6546,gene_name,log2FoldChange,pvalue,padj,"Pharmacologic perturbation contrast rather than direct hypoxia-vs-normoxia; also below the near-full-universe threshold."
