study_id,paper_id,source_url,source_path,pipeline,species,cell_system,hypoxia_modality,duration_h,n_ctrl,n_treat,gene_column,lfc_column,p_column,padj_column,sep,sheet_name,gene_type_column,gene_type_keep,assay_type,source_input_type,platform,normalization,probe_id_column,probe_collapse,table_scope,rank_universe_size,include_in_analysis,notes
ER_GSE84450_WT_DTT_vs_UT,GSE84450_DTT,https://www.ncbi.nlm.nih.gov/geo/query/acc.cgi?acc=GSE84450,data/deg/raw/er_stress/GSE84450_WT_DTT_vs_UT_cuffdiff_clean.csv,Cuffdiff2_author_table,Mus musculus,mouse embryonic fibroblast WT,DTT vs untreated,not_reported_in_table,2,2,gene_symbol,log2FoldChange,pvalue,padj,,,,,RNA-seq,author_deg_table,,Cuffdiff_FPKM,,,full_results,11428,False,As-published Cuffdiff gene_exp.diff full-result table; status != OK rows excluded before scoring. Excluded from the manuscript benchmark after the human-only species gate.
ER_GSE102505_T4213_TUN_vs_DMSO,GSE102505_glioma_TUN,https://www.ncbi.nlm.nih.gov/geo/query/acc.cgi?acc=GSE102505,data/deg/raw/er_stress/GSE102505_T4213_tunicamycin_vs_DMSO_derived_logcpm_welch.csv,logCPM_Welch_derived_from_public_counts,Homo sapiens,T4213 glioma,tunicamycin vs DMSO,not_reported_in_matrix,3,3,gene_symbol,log2FoldChange,pvalue,padj,,,,,RNA-seq,derived_count_table,,logCPM_from_raw_counts,,,full_results,9323,True,Count-derived ER-stress benchmark contrast; same GSE102505 paper_id collapses cell-line contrasts to one source unit.
ER_GSE102505_U251_TUN_vs_DMSO,GSE102505_glioma_TUN,https://www.ncbi.nlm.nih.gov/geo/query/acc.cgi?acc=GSE102505,data/deg/raw/er_stress/GSE102505_U251_tunicamycin_vs_DMSO_derived_logcpm_welch.csv,logCPM_Welch_derived_from_public_counts,Homo sapiens,U251 glioma,tunicamycin vs DMSO,not_reported_in_matrix,3,3,gene_symbol,log2FoldChange,pvalue,padj,,,,,RNA-seq,derived_count_table,,logCPM_from_raw_counts,,,full_results,10806,True,Count-derived ER-stress benchmark contrast; same GSE102505 paper_id collapses cell-line contrasts to one source unit.
ER_GSE102505_NHA_TUN_vs_DMSO,GSE102505_glioma_TUN,https://www.ncbi.nlm.nih.gov/geo/query/acc.cgi?acc=GSE102505,data/deg/raw/er_stress/GSE102505_NHA_tunicamycin_vs_DMSO_derived_logcpm_welch.csv,logCPM_Welch_derived_from_public_counts,Homo sapiens,normal human astrocytes,tunicamycin vs DMSO,not_reported_in_matrix,3,3,gene_symbol,log2FoldChange,pvalue,padj,,,,,RNA-seq,derived_count_table,,logCPM_from_raw_counts,,,full_results,10125,True,Count-derived ER-stress benchmark contrast; same GSE102505 paper_id collapses cell-line contrasts to one source unit.
ER_GSE296996_HEPG2_TUN_vs_DMSO,GSE296996_HepG2_TUN,https://www.ncbi.nlm.nih.gov/geo/query/acc.cgi?acc=GSE296996,data/deg/raw/er_stress/GSE296996_HepG2_tunicamycin_vs_DMSO_derived_logcpm_welch.csv,logCPM_Welch_derived_from_public_counts,Homo sapiens,HepG2 hepatoblastoma,tunicamycin vs DMSO,not_reported_in_matrix,5,5,gene_symbol,log2FoldChange,pvalue,padj,,,,,RNA-seq,derived_count_table,,logCPM_from_raw_counts,,,full_results,10579,True,"Count-derived human ER-stress benchmark contrast (HepG2 tunicamycin vs DMSO, GSM8981325-29 vs GSM8981330-34) added to reach >=2 independent human RNA-seq source units."
ER_GSE245918_OCI_AML3_TUN_vs_DMSO,GSE245918_TUN,https://www.ncbi.nlm.nih.gov/geo/query/acc.cgi?acc=GSE245918,data/deg/raw/er_stress/GSE245918_OCI_AML3_tunicamycin_vs_DMSO_derived_logcpm_welch.csv,logCPM_Welch_derived_from_public_counts,Homo sapiens,OCI-AML3 acute myeloid leukemia,tunicamycin vs DMSO,24,3,3,gene_symbol,log2FoldChange,pvalue,padj,,,,,RNA-seq,derived_count_table,,logCPM_from_raw_counts,,,full_results,12234,True,Count-derived human ER-stress benchmark contrast; same GSE245918 paper_id collapses OCI-AML3 and HEK293T cell-line contrasts to one source unit.
ER_GSE245918_HEK293T_TUN_vs_DMSO,GSE245918_TUN,https://www.ncbi.nlm.nih.gov/geo/query/acc.cgi?acc=GSE245918,data/deg/raw/er_stress/GSE245918_HEK293T_tunicamycin_vs_DMSO_derived_logcpm_welch.csv,logCPM_Welch_derived_from_public_counts,Homo sapiens,HEK293T embryonic kidney,tunicamycin vs DMSO,24,3,3,gene_symbol,log2FoldChange,pvalue,padj,,,,,RNA-seq,derived_count_table,,logCPM_from_raw_counts,,,full_results,13070,True,Count-derived human ER-stress benchmark contrast; same GSE245918 paper_id collapses OCI-AML3 and HEK293T cell-line contrasts to one source unit.
ER_GSE103667_THAP_vs_DMSO,GSE103667_THAP,https://www.ncbi.nlm.nih.gov/geo/query/acc.cgi?acc=GSE103667,data/deg/raw/er_stress/GSE103667_THAP_vs_DMSO_normexpr_welch.csv,welch_normalized_expression_matrix,Mus musculus,TE matrix source,thapsigargin vs DMSO,not_reported_in_matrix,2,2,gene_symbol,log2FoldChange,pvalue,padj,,,,,RNA-seq,normalized_expression_matrix,,TE.norm,,,full_results,11415,False,"Secondary ER-stress source from normalized expression matrix with two replicates per group; included as lower-confidence support, not a full author DEG table. Excluded from the manuscript benchmark after the human-only species gate. Excluded from primary-only ER benchmark because it is a lower-confidence normalized-matrix source; retained in full sensitivity."
