study_id,paper_id,source_url,source_path,pipeline,species,cell_system,hypoxia_modality,duration_h,n_ctrl,n_treat,gene_column,lfc_column,p_column,padj_column,sep,sheet_name,gene_type_column,gene_type_keep,table_scope,rank_universe_size,include_in_analysis,notes,assay_type,source_input_type,platform,normalization,probe_id_column,probe_collapse
INDISULAM_GSE223011_KURAMOCHI_24h,GSE223011_Xu2023,https://www.ncbi.nlm.nih.gov/geo/query/acc.cgi?acc=GSE223011,data/deg/raw/indisulam/GSE223011_KURAMOCHI_indisulam_24h_vs_vehicle_derived_logcpm_welch.csv,logCPM_Welch_derived_from_public_counts,Homo sapiens,KURAMOCHI high-grade serous ovarian carcinoma,Indisulam 10uM vs vehicle,24,3,3,gene_symbol,log2FoldChange,pvalue,padj,,,,,full_results,41984,True,Derived-count Indisulam pilot contrast; log2FC and p-values computed from public count matrix using logCPM and Welch t-test. Not an as-published author DEG table.,,,,,,
INDISULAM_GSE268568_CAL27_WT_24h,GSE268568_Ando2024,https://www.ncbi.nlm.nih.gov/geo/query/acc.cgi?acc=GSE268568,data/deg/raw/indisulam/GSE268568_CAL27_WT_indisulam_24h_vs_DMSO_derived_logcpm_welch.csv,logCPM_Welch_derived_from_public_counts,Homo sapiens,CAL27 WT,Indisulam 1uM vs DMSO,24,3,3,gene_symbol,log2FoldChange,pvalue,padj,,,,,full_results,42992,True,Derived-count Indisulam pilot contrast; log2FC and p-values computed from public count matrix using logCPM and Welch t-test. Not an as-published author DEG table.,,,,,,
INDISULAM_GSE268568_CAL27_LATS12KO_24h,GSE268568_Ando2024,https://www.ncbi.nlm.nih.gov/geo/query/acc.cgi?acc=GSE268568,data/deg/raw/indisulam/GSE268568_CAL27_LATS12KO_indisulam_24h_vs_DMSO_derived_logcpm_welch.csv,logCPM_Welch_derived_from_public_counts,Homo sapiens,CAL27 LATS1/2 KO,Indisulam 1uM vs DMSO,24,3,3,gene_symbol,log2FoldChange,pvalue,padj,,,,,full_results,42992,True,Derived-count Indisulam pilot contrast; log2FC and p-values computed from public count matrix using logCPM and Welch t-test. Not an as-published author DEG table.,,,,,,
SULFONAMIDE_GSE93829_HCT116_E7820_24h,GSE93829_Uehara2017,https://www.ncbi.nlm.nih.gov/geo/query/acc.cgi?acc=GSE93829,data/deg/raw/microarray/GSE93829_HCT116_E7820_24h_vs_DMSO_microarray_welch.csv,welch_microarray_normalized_matrix,Homo sapiens,HCT116,E7820 1uM 24h vs DMSO,24,3,3,gene_symbol,log2FoldChange,pvalue,padj,,,,,full_results,,True,Microarray sensitivity layer for aryl-sulfonamide/RBM39 axis; not direct Indisulam.,microarray,normalized_expression_matrix,GPL17077,GeneSpring_12.5_processed_series_matrix_log_scale,probe_id,min_pvalue_max_abs_lfc
RBM39KD_GSE93829_HCT116_siRBM39_48h,GSE93829_Uehara2017,https://www.ncbi.nlm.nih.gov/geo/query/acc.cgi?acc=GSE93829,data/deg/raw/microarray/GSE93829_HCT116_siRBM39_48h_vs_nontarget_microarray_welch.csv,welch_microarray_normalized_matrix,Homo sapiens,HCT116,siRBM39 48h vs non-target siRNA,48,3,3,gene_symbol,log2FoldChange,pvalue,padj,,,,,full_results,,True,"Genetic RBM39 perturbation microarray sensitivity layer; mechanism anchor, not drug treatment.",microarray,normalized_expression_matrix,GPL17077,GeneSpring_12.5_processed_series_matrix_log_scale,probe_id,min_pvalue_max_abs_lfc
